platform,source_url,username,date,content
Reddit,https://reddit.com/r/sales,u/sdr_burnedout_blr,2026-04-26,"Anyone else getting destroyed by Apollo's India data lately? Sent 200 emails this week to fintech contacts in Mumbai/Bangalore — got 84 hard bounces. That's 42 percent. Wasted half my month's credits. We're a Series A SaaS in HSR Layout, looking at alternatives that actually have working APAC data. Tried Lusha briefly — same problem. Suggestions?"
Reddit,https://reddit.com/r/SalesOperations,u/revops_priya,2026-04-24,"Update on switching off ZoomInfo: we cancelled last week. 18-month contract was 52k. Replacing with [evaluating 3 options]. Breaking point was 60%+ bounce rate on our enterprise India accounts. If anyone in r/sales has built a reliable APAC outbound stack would love a 15min call. - Priya, RevOps @ ScaleHQ"
Reddit,https://reddit.com/r/sales,u/coldemail_dropout,2026-04-22,"Curious what everyone's using for outbound data these days. We've been on ZoomInfo for 2 years and contract is up in 8 weeks. Honestly the data quality has gotten worse and the price hike is brutal. Open to hearing about alternatives, especially anything that handles non-US markets well."
Reddit,https://reddit.com/r/sales,u/wfh_skeptic,2026-04-25,"yeah cold outreach is dead lol. nobody opens emails anymore. we should all just do linkedin"
LinkedIn,https://linkedin.com/posts/marcus-k-apollo,Marcus K (Apollo Sales),2026-04-23,"Hey everyone — I work at Apollo and we've been investing heavily in our APAC data team this year. If anyone's having issues with bounce rates DM me directly and I can take a look at your account specifically."
G2,https://g2.com/products/apollo-io/reviews,Verified User in Computer Software,2026-04-19,"Rating: 2/5. Apollo was great when we were US-only. Started selling into India and Singapore last quarter and the data quality fell off a cliff. 1 in 3 mobile numbers wrong, emails bouncing constantly. Support told us they're 'working on APAC coverage'. Looking at alternatives now."